"No.","Time","Source","Destination","Protocol","Length","Info"
"1","01:05:49.468757","172.16.1.4","172.16.1.255","BROWSER","243","Host Announcement CARLFORCE-DC1, Workstation, Server, Domain Controller, Time Source, NT Workstation, DFS server"
"2","01:05:50.279222","172.16.1.4","172.16.1.255","BROWSER","243","Host Announcement CARLFORCE-DC1, Workstation, Server, Domain Controller, Time Source, NT Workstation, DFS server"
"3","01:06:10.328524","172.16.1.201","224.0.0.252","LLMNR","66","Standard query 0x229b A isatap"
"4","01:06:10.390913","172.16.1.201","172.16.1.4","DNS","76","Standard query 0x6ef6 A www.msftncsi.com"
"5","01:06:10.391325","172.16.1.201","172.16.1.4","DNS","76","Standard query 0x6ef6 A www.msftncsi.com"
"6","01:06:10.430028","172.16.1.201","172.16.1.255","NBNS","92","Name query NB CARLFORCE<1c>"
"7","01:06:10.430142","172.16.1.4","172.16.1.201","NBNS","104","Name query response NB 172.16.1.4"
"8","01:06:10.430821","172.16.1.201","172.16.1.255","SMB_NETLOGON","281","SAM LOGON request from client"
"9","01:06:10.430822","172.16.1.201","172.16.1.4","SMB_NETLOGON","281","SAM LOGON request from client"
"10","01:06:10.431132","172.16.1.4","172.16.1.255","NBNS","92","Name query NB NEWARK-1A<00>"
"11","01:06:10.431463","172.16.1.201","172.16.1.4","NBNS","104","Name query response NB 172.16.1.201"
"12","01:06:10.431509","172.16.1.4","172.16.1.201","SMB_NETLOGON","352","SAM Active Directory Response - user unknown"
"13","01:06:10.437430","172.16.1.201","224.0.0.252","LLMNR","66","Standard query 0x229b A isatap"
"14","01:06:10.437431","172.16.1.201","172.16.1.255","NBNS","92","Name query NB CARLFORCE<1c>"
"15","01:06:10.437557","172.16.1.4","172.16.1.201","NBNS","104","Name query response NB 172.16.1.4"
"16","01:06:10.438229","172.16.1.201","172.16.1.255","SMB_NETLOGON","281","SAM LOGON request from client"
"17","01:06:10.438230","172.16.1.201","172.16.1.4","SMB_NETLOGON","281","SAM LOGON request from client"
"18","01:06:10.438405","172.16.1.4","172.16.1.201","SMB_NETLOGON","352","SAM Active Directory Response - user unknown"
"19","01:06:10.498016","172.16.1.4","172.16.1.201","DNS","182","Standard query response 0x6ef6 A www.msftncsi.com CNAME www.msftncsi.com.edgesuite.net CNAME a1961.g2.akamai.net A 173.223.52.18 A 173.223.52.17"
"20","01:06:10.531430","172.16.1.201","172.16.1.4","DNS","87","Standard query 0x7373 A CARLFORCE-DC1.carlforce.com"
"21","01:06:10.531557","172.16.1.4","172.16.1.201","DNS","103","Standard query response 0x7373 A CARLFORCE-DC1.carlforce.com A 172.16.1.4"
"22","01:06:10.533451","172.16.1.201","172.16.1.4","TCP","66","49158  >  389 [SYN] Seq=0 Win=8192 Len=0 MSS=1460 WS=256 SACK_PERM=1"
"23","01:06:10.533510","172.16.1.4","172.16.1.201","TCP","66","389  >  49158 [SYN, ACK] Seq=0 Ack=1 Win=8192 Len=0 MSS=1460 WS=256 SACK_PERM=1"
"24","01:06:10.533849","172.16.1.201","172.16.1.4","TCP","60","49158  >  389 [ACK] Seq=1 Ack=1 Win=65536 Len=0"
"25","01:06:10.546972","172.16.1.201","172.16.1.4","DNS","87","Standard query 0x2f1e A CARLFORCE-DC1.carlforce.com"
"26","01:06:10.547091","172.16.1.4","172.16.1.201","DNS","103","Standard query response 0x2f1e A CARLFORCE-DC1.carlforce.com A 172.16.1.4"
"27","01:06:10.596069","172.16.1.201","172.16.1.4","LDAP","404","searchRequest(1) ""<ROOT>"" baseObject "
"28","01:06:10.596323","172.16.1.4","172.16.1.201","LDAP","2373","searchResEntry(1) ""<ROOT>""  | searchResDone(1) success  [4 results]"
"29","01:06:10.597149","172.16.1.201","172.16.1.4","TCP","60","49158  >  389 [ACK] Seq=351 Ack=2320 Win=65536 Len=0"
"30","01:06:10.597150","172.16.1.201","172.16.1.4","DNS","87","Standard query 0xf166 A CARLFORCE-DC1.carlforce.com"
"31","01:06:10.597263","172.16.1.4","172.16.1.201","DNS","103","Standard query response 0xf166 A CARLFORCE-DC1.carlforce.com A 172.16.1.4"
"32","01:06:10.599041","172.16.1.201","172.16.1.4","TCP","66","49159  >  88 [SYN] Seq=0 Win=8192 Len=0 MSS=1460 WS=256 SACK_PERM=1"
"33","01:06:10.599042","172.16.1.201","172.16.1.4","TCP","66","49160  >  135 [SYN] Seq=0 Win=8192 Len=0 MSS=1460 WS=256 SACK_PERM=1"
"34","01:06:10.599094","172.16.1.4","172.16.1.201","TCP","66","88  >  49159 [SYN, ACK] Seq=0 Ack=1 Win=8192 Len=0 MSS=1460 WS=256 SACK_PERM=1"
"35","01:06:10.599122","172.16.1.4","172.16.1.201","TCP","66","135  >  49160 [SYN, ACK] Seq=0 Ack=1 Win=8192 Len=0 MSS=1460 WS=256 SACK_PERM=1"
"36","01:06:10.599442","172.16.1.201","172.16.1.4","TCP","60","49159  >  88 [ACK] Seq=1 Ack=1 Win=65536 Len=0"
"37","01:06:10.599443","172.16.1.201","172.16.1.4","TCP","60","49160  >  135 [ACK] Seq=1 Ack=1 Win=65536 Len=0"
"38","01:06:10.599785","172.16.1.201","172.16.1.4","KRB5","290","AS-REQ"
"39","01:06:10.600335","172.16.1.4","172.16.1.201","KRB5","324","KRB Error: KRB5KDC_ERR_PREAUTH_REQUIRED"
"40","01:06:10.600667","172.16.1.201","172.16.1.4","TCP","60","49159  >  88 [FIN, ACK] Seq=237 Ack=271 Win=65280 Len=0"
"41","01:06:10.600687","172.16.1.4","172.16.1.201","TCP","54","88  >  49159 [ACK] Seq=271 Ack=238 Win=65536 Len=0"
"42","01:06:10.600730","172.16.1.4","172.16.1.201","TCP","54","88  >  49159 [RST, ACK] Seq=271 Ack=238 Win=0 Len=0"
"43","01:06:10.601023","172.16.1.201","172.16.1.4","DCERPC","214","Bind: call_id: 2, Fragment: Single, 3 context items: EPMv4 V3.0 (32bit NDR), EPMv4 V3.0 (64bit NDR), EPMv4 V3.0 (6cb71c2c-9812-4540-0300-000000000000)"
"44","01:06:10.601066","172.16.1.4","172.16.1.201","DCERPC","162","Bind_ack: call_id: 2, Fragment: Single, max_xmit: 5840 max_recv: 5840, 3 results: Provider rejection, Acceptance, Negotiate ACK"
"45","01:06:10.601398","172.16.1.201","172.16.1.4","EPM","222","Map request, DRSUAPI, 32bit NDR"
"46","01:06:10.601483","172.16.1.4","172.16.1.201","EPM","226","Map response, DRSUAPI, 32bit NDR"
"47","01:06:10.633575","172.16.1.201","172.16.1.4","TCP","66","49161  >  88 [SYN] Seq=0 Win=8192 Len=0 MSS=1460 WS=256 SACK_PERM=1"
"48","01:06:10.633625","172.16.1.4","172.16.1.201","TCP","66","88  >  49161 [SYN, ACK] Seq=0 Ack=1 Win=8192 Len=0 MSS=1460 WS=256 SACK_PERM=1"
"49","01:06:10.633964","172.16.1.201","172.16.1.4","TCP","60","49161  >  88 [ACK] Seq=1 Ack=1 Win=65536 Len=0"
"50","01:06:10.633964","172.16.1.201","172.16.1.4","KRB5","370","AS-REQ"
"51","01:06:10.634519","172.16.1.201","172.16.1.4","TCP","66","49162  >  49155 [SYN] Seq=0 Win=8192 Len=0 MSS=1460 WS=256 SACK_PERM=1"
"52","01:06:10.634551","172.16.1.4","172.16.1.201","TCP","66","49155  >  49162 [SYN, ACK] Seq=0 Ack=1 Win=8192 Len=0 MSS=1460 WS=256 SACK_PERM=1"
"53","01:06:10.634888","172.16.1.201","172.16.1.4","TCP","60","49162  >  49155 [ACK] Seq=1 Ack=1 Win=65536 Len=0"
"54","01:06:10.635279","172.16.1.4","172.16.1.201","KRB5","1599","AS-REP"
"55","01:06:10.635613","172.16.1.201","172.16.1.4","TCP","66","49163  >  88 [SYN] Seq=0 Win=8192 Len=0 MSS=1460 WS=256 SACK_PERM=1"
"56","01:06:10.635645","172.16.1.4","172.16.1.201","TCP","66","88  >  49163 [SYN, ACK] Seq=0 Ack=1 Win=8192 Len=0 MSS=1460 WS=256 SACK_PERM=1"
"57","01:06:10.635986","172.16.1.201","172.16.1.4","TCP","60","49161  >  88 [ACK] Seq=317 Ack=1546 Win=65536 Len=0"
"58","01:06:10.635987","172.16.1.201","172.16.1.4","TCP","60","49163  >  88 [ACK] Seq=1 Ack=1 Win=65536 Len=0"
"59","01:06:10.635987","172.16.1.201","172.16.1.4","TCP","60","49161  >  88 [FIN, ACK] Seq=317 Ack=1546 Win=65536 Len=0"
"60","01:06:10.635988","172.16.1.201","172.16.1.4","KRB5","290","AS-REQ"
"61","01:06:10.636025","172.16.1.4","172.16.1.201","TCP","54","88  >  49161 [ACK] Seq=1546 Ack=318 Win=65536 Len=0"
"62","01:06:10.636112","172.16.1.4","172.16.1.201","TCP","54","88  >  49161 [RST, ACK] Seq=1546 Ack=318 Win=0 Len=0"
"63","01:06:10.636646","172.16.1.4","172.16.1.201","KRB5","324","KRB Error: KRB5KDC_ERR_PREAUTH_REQUIRED"
"64","01:06:10.636981","172.16.1.201","172.16.1.4","TCP","60","49163  >  88 [FIN, ACK] Seq=237 Ack=271 Win=65280 Len=0"
"65","01:06:10.636999","172.16.1.4","172.16.1.201","TCP","54","88  >  49163 [ACK] Seq=271 Ack=238 Win=65536 Len=0"
"66","01:06:10.637037","172.16.1.4","172.16.1.201","TCP","54","88  >  49163 [RST, ACK] Seq=271 Ack=238 Win=0 Len=0"
"67","01:06:10.640519","172.16.1.201","172.16.1.255","NBNS","92","Name query NB ISATAP<00>"
"68","01:06:10.670094","172.16.1.201","172.16.1.4","TCP","66","49164  >  88 [SYN] Seq=0 Win=8192 Len=0 MSS=1460 WS=256 SACK_PERM=1"
"69","01:06:10.670095","172.16.1.201","172.16.1.4","TCP","66","49165  >  88 [SYN] Seq=0 Win=8192 Len=0 MSS=1460 WS=256 SACK_PERM=1"
"70","01:06:10.670146","172.16.1.4","172.16.1.201","TCP","66","88  >  49164 [SYN, ACK] Seq=0 Ack=1 Win=8192 Len=0 MSS=1460 WS=256 SACK_PERM=1"
"71","01:06:10.670174","172.16.1.4","172.16.1.201","TCP","66","88  >  49165 [SYN, ACK] Seq=0 Ack=1 Win=8192 Len=0 MSS=1460 WS=256 SACK_PERM=1"
"72","01:06:10.670494","172.16.1.201","172.16.1.4","TCP","60","49164  >  88 [ACK] Seq=1 Ack=1 Win=65536 Len=0"
"73","01:06:10.670495","172.16.1.201","172.16.1.4","TCP","60","49165  >  88 [ACK] Seq=1 Ack=1 Win=65536 Len=0"
"74","01:06:10.670496","172.16.1.201","172.16.1.4","KRB5","370","AS-REQ"
"75","01:06:10.670877","172.16.1.201","172.16.1.4","TCP","1514","49165  >  88 [ACK] Seq=1 Ack=1 Win=65536 Len=1460 [TCP segment of a reassembled PDU]"
"76","01:06:10.670880","172.16.1.201","172.16.1.4","KRB5","182","TGS-REQ"
"77","01:06:10.670900","172.16.1.4","172.16.1.201","TCP","54","88  >  49165 [ACK] Seq=1 Ack=1589 Win=65536 Len=0"
"78","01:06:10.672024","172.16.1.4","172.16.1.201","KRB5","1614","TGS-REP"
"79","01:06:10.672668","172.16.1.4","172.16.1.201","KRB5","1599","AS-REP"
"80","01:06:10.672809","172.16.1.201","172.16.1.4","TCP","60","49165  >  88 [ACK] Seq=1589 Ack=1561 Win=65536 Len=0"
"81","01:06:10.672810","172.16.1.201","172.16.1.4","TCP","60","49165  >  88 [FIN, ACK] Seq=1589 Ack=1561 Win=65536 Len=0"
"82","01:06:10.672833","172.16.1.4","172.16.1.201","TCP","54","88  >  49165 [ACK] Seq=1561 Ack=1590 Win=65536 Len=0"
"83","01:06:10.672874","172.16.1.4","172.16.1.201","TCP","54","88  >  49165 [RST, ACK] Seq=1561 Ack=1590 Win=0 Len=0"
"84","01:06:10.673482","172.16.1.201","172.16.1.4","TCP","1514","49158  >  389 [ACK] Seq=351 Ack=2320 Win=65536 Len=1460 [TCP segment of a reassembled PDU]"
"85","01:06:10.673483","172.16.1.201","172.16.1.4","LDAP","297","bindRequest(3) ""<ROOT>"" sasl "
"86","01:06:10.673484","172.16.1.201","172.16.1.4","TCP","60","49164  >  88 [ACK] Seq=317 Ack=1546 Win=65536 Len=0"
"87","01:06:10.673485","172.16.1.201","172.16.1.4","TCP","60","49164  >  88 [FIN, ACK] Seq=317 Ack=1546 Win=65536 Len=0"
"88","01:06:10.673514","172.16.1.4","172.16.1.201","TCP","54","389  >  49158 [ACK] Seq=2320 Ack=2054 Win=65536 Len=0"
"89","01:06:10.673521","172.16.1.4","172.16.1.201","TCP","54","88  >  49164 [ACK] Seq=1546 Ack=318 Win=65536 Len=0"
"90","01:06:10.673583","172.16.1.4","172.16.1.201","TCP","54","88  >  49164 [RST, ACK] Seq=1546 Ack=318 Win=0 Len=0"
"91","01:06:10.673850","172.16.1.201","172.16.1.4","TCP","1514","49162  >  49155 [ACK] Seq=1 Ack=1 Win=65536 Len=1460 [TCP segment of a reassembled PDU]"
"92","01:06:10.673852","172.16.1.201","172.16.1.4","DCERPC","406","Bind: call_id: 2, Fragment: Single, 3 context items: DRSUAPI V4.0 (32bit NDR), DRSUAPI V4.0 (64bit NDR), DRSUAPI V4.0 (6cb71c2c-9812-4540-0300-000000000000)"
"93","01:06:10.673875","172.16.1.4","172.16.1.201","TCP","54","49155  >  49162 [ACK] Seq=1 Ack=1813 Win=65536 Len=0"
"94","01:06:10.674553","172.16.1.4","172.16.1.201","LDAP","264","bindResponse(3) success "
"95","01:06:10.675215","172.16.1.4","172.16.1.201","DCERPC","338","Bind_ack: call_id: 2, Fragment: Single, max_xmit: 5840 max_recv: 5840, 3 results: Provider rejection, Acceptance, Negotiate ACK"
"96","01:06:10.676021","172.16.1.201","172.16.1.4","DCERPC","274","Alter_context: call_id: 2, Fragment: Single, 1 context items: DRSUAPI V4.0 (64bit NDR)"
"97","01:06:10.676254","172.16.1.4","172.16.1.201","DCERPC","159","Alter_context_resp: call_id: 2, Fragment: Single, max_xmit: 5840 max_recv: 5840, 1 results: Acceptance"
"98","01:06:10.677054","172.16.1.201","172.16.1.4","DRSUAPI","306","DsBind request"
"99","01:06:10.677055","172.16.1.201","172.16.1.4","LDAP","170","SASL GSS-API Integrity: searchRequest(4) ""<ROOT>"" baseObject "
"100","01:06:10.677281","172.16.1.4","172.16.1.201","DRSUAPI","258","DsBind response"
"101","01:06:10.677362","172.16.1.4","172.16.1.201","LDAP","209","SASL GSS-API Integrity: searchResEntry(4) ""<ROOT>"" searchResDone(4) success  [4 results]"
"102","01:06:10.678074","172.16.1.201","172.16.1.4","DRSUAPI","322","DsCrackNames request"
"103","01:06:10.678075","172.16.1.201","172.16.1.4","LDAP","156","SASL GSS-API Integrity: searchRequest(5) ""<ROOT>"" baseObject "
"104","01:06:10.678406","172.16.1.4","172.16.1.201","DRSUAPI","418","DsCrackNames response"
"105","01:06:10.678514","172.16.1.4","172.16.1.201","LDAP","277","SASL GSS-API Integrity: searchResEntry(5) ""<ROOT>"" searchResDone(5) success  [4 results]"
"106","01:06:10.679124","172.16.1.201","172.16.1.4","DRSUAPI","322","DsCrackNames request"
"107","01:06:10.679125","172.16.1.201","172.16.1.4","LDAP","272","SASL GSS-API Integrity: searchRequest(6) ""CN=NTDS Settings,CN=CARLFORCE-DC1,CN=Servers,CN=Default-First-Site-Name,CN=Sites,CN=Configuration,DC=carlforce,DC=com"" baseObject "
"108","01:06:10.679422","172.16.1.4","172.16.1.201","DRSUAPI","402","DsCrackNames response"
"109","01:06:10.679595","172.16.1.4","172.16.1.201","LDAP","292","SASL GSS-API Integrity: searchResEntry(6) ""CN=NTDS Settings,CN=CARLFORCE-DC1,CN=Servers,CN=Default-First-Site-Name,CN=Sites,CN=Configuration,DC=carlforce,DC=com"" searchResDone(6) success  [4 results]"
"110","01:06:10.680088","172.16.1.201","172.16.1.4","DRSUAPI","194","DsUnbind request"
"111","01:06:10.680089","172.16.1.201","172.16.1.4","LDAP","254","SASL GSS-API Integrity: searchRequest(7) ""CN=Public Key Services,CN=Services,CN=Configuration,DC=carlforce,DC=com"" wholeSubtree "
"112","01:06:10.680204","172.16.1.4","172.16.1.201","DRSUAPI","194","DsUnbind response"
"113","01:06:10.680389","172.16.1.4","172.16.1.201","LDAP","108","SASL GSS-API Integrity: searchResDone(7) success  [4 results]"
"114","01:06:10.682337","172.16.1.201","172.16.1.4","TCP","66","49166  >  135 [SYN] Seq=0 Win=8192 Len=0 MSS=1460 WS=256 SACK_PERM=1"
"115","01:06:10.682386","172.16.1.4","172.16.1.201","TCP","66","135  >  49166 [SYN, ACK] Seq=0 Ack=1 Win=8192 Len=0 MSS=1460 WS=256 SACK_PERM=1"
"116","01:06:10.682722","172.16.1.201","172.16.1.4","TCP","60","49166  >  135 [ACK] Seq=1 Ack=1 Win=65536 Len=0"
"117","01:06:10.683077","172.16.1.201","172.16.1.4","DCERPC","214","Bind: call_id: 2, Fragment: Single, 3 context items: EPMv4 V3.0 (32bit NDR), EPMv4 V3.0 (64bit NDR), EPMv4 V3.0 (6cb71c2c-9812-4540-0300-000000000000)"
"118","01:06:10.683120","172.16.1.4","172.16.1.201","DCERPC","162","Bind_ack: call_id: 2, Fragment: Single, max_xmit: 5840 max_recv: 5840, 3 results: Provider rejection, Acceptance, Negotiate ACK"
"119","01:06:10.683450","172.16.1.201","172.16.1.4","EPM","222","Map request, DRSUAPI, 32bit NDR"
"120","01:06:10.683528","172.16.1.4","172.16.1.201","EPM","226","Map response, DRSUAPI, 32bit NDR"
"121","01:06:10.685018","172.16.1.201","172.16.1.4","TCP","66","49167  >  49155 [SYN] Seq=0 Win=8192 Len=0 MSS=1460 WS=256 SACK_PERM=1"
"122","01:06:10.685068","172.16.1.4","172.16.1.201","TCP","66","49155  >  49167 [SYN, ACK] Seq=0 Ack=1 Win=8192 Len=0 MSS=1460 WS=256 SACK_PERM=1"
"123","01:06:10.685406","172.16.1.201","172.16.1.4","TCP","66","49168  >  389 [SYN] Seq=0 Win=8192 Len=0 MSS=1460 WS=256 SACK_PERM=1"
"124","01:06:10.685407","172.16.1.201","172.16.1.4","TCP","60","49167  >  49155 [ACK] Seq=1 Ack=1 Win=65536 Len=0"
"125","01:06:10.685432","172.16.1.4","172.16.1.201","TCP","66","389  >  49168 [SYN, ACK] Seq=0 Ack=1 Win=8192 Len=0 MSS=1460 WS=256 SACK_PERM=1"
"126","01:06:10.685774","172.16.1.201","172.16.1.4","TCP","60","49168  >  389 [ACK] Seq=1 Ack=1 Win=65536 Len=0"
"127","01:06:10.685775","172.16.1.201","172.16.1.4","TCP","66","49169  >  88 [SYN] Seq=0 Win=8192 Len=0 MSS=1460 WS=256 SACK_PERM=1"
"128","01:06:10.685815","172.16.1.4","172.16.1.201","TCP","66","88  >  49169 [SYN, ACK] Seq=0 Ack=1 Win=8192 Len=0 MSS=1460 WS=256 SACK_PERM=1"
"129","01:06:10.686151","172.16.1.201","172.16.1.4","TCP","60","49169  >  88 [ACK] Seq=1 Ack=1 Win=65536 Len=0"
"130","01:06:10.686484","172.16.1.201","172.16.1.4","TCP","1514","49169  >  88 [ACK] Seq=1 Ack=1 Win=65536 Len=1460 [TCP segment of a reassembled PDU]"
"131","01:06:10.686487","172.16.1.201","172.16.1.4","KRB5","167","TGS-REQ"
"132","01:06:10.686506","172.16.1.4","172.16.1.201","TCP","54","88  >  49169 [ACK] Seq=1 Ack=1574 Win=65536 Len=0"
"133","01:06:10.687666","172.16.1.4","172.16.1.201","KRB5","1605","TGS-REP"
"134","01:06:10.688437","172.16.1.201","172.16.1.4","TCP","60","49169  >  88 [ACK] Seq=1574 Ack=1552 Win=65536 Len=0"
"135","01:06:10.688438","172.16.1.201","172.16.1.4","TCP","60","49169  >  88 [FIN, ACK] Seq=1574 Ack=1552 Win=65536 Len=0"
"136","01:06:10.688460","172.16.1.4","172.16.1.201","TCP","54","88  >  49169 [ACK] Seq=1552 Ack=1575 Win=65536 Len=0"
"137","01:06:10.688499","172.16.1.4","172.16.1.201","TCP","54","88  >  49169 [RST, ACK] Seq=1552 Ack=1575 Win=0 Len=0"
"138","01:06:10.689130","172.16.1.201","172.16.1.4","TCP","1514","49167  >  49155 [ACK] Seq=1 Ack=1 Win=65536 Len=1460 [TCP segment of a reassembled PDU]"
"139","01:06:10.689132","172.16.1.201","172.16.1.4","DCERPC","391","Bind: call_id: 2, Fragment: Single, 3 context items: DRSUAPI V4.0 (32bit NDR), DRSUAPI V4.0 (64bit NDR), DRSUAPI V4.0 (6cb71c2c-9812-4540-0300-000000000000)"
"140","01:06:10.689152","172.16.1.4","172.16.1.201","TCP","54","49155  >  49167 [ACK] Seq=1 Ack=1798 Win=65536 Len=0"
"141","01:06:10.689488","172.16.1.201","172.16.1.4","TCP","1514","49168  >  389 [ACK] Seq=1 Ack=1 Win=65536 Len=1460 [TCP segment of a reassembled PDU]"
"142","01:06:10.689491","172.16.1.201","172.16.1.4","LDAP","297","bindRequest(10) ""<ROOT>"" sasl "
"143","01:06:10.689509","172.16.1.4","172.16.1.201","TCP","54","389  >  49168 [ACK] Seq=1 Ack=1704 Win=65536 Len=0"
"144","01:06:10.690397","172.16.1.4","172.16.1.201","DCERPC","338","Bind_ack: call_id: 2, Fragment: Single, max_xmit: 5840 max_recv: 5840, 3 results: Provider rejection, Acceptance, Negotiate ACK"
"145","01:06:10.690647","172.16.1.4","172.16.1.201","LDAP","264","bindResponse(10) success "
"146","01:06:10.691203","172.16.1.201","172.16.1.4","DCERPC","274","Alter_context: call_id: 2, Fragment: Single, 1 context items: DRSUAPI V4.0 (64bit NDR)"
"147","01:06:10.691204","172.16.1.201","172.16.1.4","LDAP","187","SASL GSS-API Integrity: searchRequest(11) ""<ROOT>"" baseObject "
"148","01:06:10.691432","172.16.1.4","172.16.1.201","DCERPC","159","Alter_context_resp: call_id: 2, Fragment: Single, max_xmit: 5840 max_recv: 5840, 1 results: Acceptance"
"149","01:06:10.691524","172.16.1.4","172.16.1.201","LDAP","264","SASL GSS-API Integrity: searchResEntry(11) ""<ROOT>"" searchResDone(11) success  [1 result]"
"150","01:06:10.693575","172.16.1.201","172.16.1.4","DRSUAPI","306","DsBind request"
"151","01:06:10.693829","172.16.1.4","172.16.1.201","DRSUAPI","258","DsBind response"
"152","01:06:10.694163","172.16.1.201","172.16.1.4","TCP","66","49170  >  88 [SYN] Seq=0 Win=8192 Len=0 MSS=1460 WS=256 SACK_PERM=1"
"153","01:06:10.694205","172.16.1.4","172.16.1.201","TCP","66","88  >  49170 [SYN, ACK] Seq=0 Ack=1 Win=8192 Len=0 MSS=1460 WS=256 SACK_PERM=1"
"154","01:06:10.694542","172.16.1.201","172.16.1.4","DRSUAPI","450","DsWriteAccountSpn request"
"155","01:06:10.694543","172.16.1.201","172.16.1.4","TCP","60","49170  >  88 [ACK] Seq=1 Ack=1 Win=65536 Len=0"
"156","01:06:10.694544","172.16.1.201","172.16.1.4","KRB5","290","AS-REQ"
"157","01:06:10.695017","172.16.1.4","172.16.1.201","DRSUAPI","178","DsWriteAccountSpn response"
"158","01:06:10.695545","172.16.1.4","172.16.1.201","KRB5","324","KRB Error: KRB5KDC_ERR_PREAUTH_REQUIRED"
"159","01:06:10.695684","172.16.1.201","172.16.1.4","DRSUAPI","434","DsWriteAccountSpn request"
"160","01:06:10.696097","172.16.1.4","172.16.1.201","DRSUAPI","178","DsWriteAccountSpn response"
"161","01:06:10.696105","172.16.1.201","172.16.1.4","TCP","60","49170  >  88 [FIN, ACK] Seq=237 Ack=271 Win=65280 Len=0"
"162","01:06:10.696125","172.16.1.4","172.16.1.201","TCP","54","88  >  49170 [ACK] Seq=271 Ack=238 Win=65536 Len=0"
"163","01:06:10.696205","172.16.1.4","172.16.1.201","TCP","54","88  >  49170 [RST, ACK] Seq=271 Ack=238 Win=0 Len=0"
"164","01:06:10.696769","172.16.1.201","172.16.1.4","DRSUAPI","194","DsUnbind request"
"165","01:06:10.696883","172.16.1.4","172.16.1.201","DRSUAPI","194","DsUnbind response"
"166","01:06:10.728531","172.16.1.201","172.16.1.4","TCP","66","49171  >  88 [SYN] Seq=0 Win=8192 Len=0 MSS=1460 WS=256 SACK_PERM=1"
"167","01:06:10.728582","172.16.1.4","172.16.1.201","TCP","66","88  >  49171 [SYN, ACK] Seq=0 Ack=1 Win=8192 Len=0 MSS=1460 WS=256 SACK_PERM=1"
"168","01:06:10.728922","172.16.1.201","172.16.1.4","TCP","60","49171  >  88 [ACK] Seq=1 Ack=1 Win=65536 Len=0"
"169","01:06:10.728922","172.16.1.201","172.16.1.4","KRB5","370","AS-REQ"
"170","01:06:10.729916","172.16.1.4","172.16.1.201","KRB5","1599","AS-REP"
"171","01:06:10.730706","172.16.1.201","172.16.1.4","TCP","60","49171  >  88 [ACK] Seq=317 Ack=1546 Win=65536 Len=0"
"172","01:06:10.730706","172.16.1.201","172.16.1.4","TCP","60","49171  >  88 [FIN, ACK] Seq=317 Ack=1546 Win=65536 Len=0"
"173","01:06:10.730730","172.16.1.4","172.16.1.201","TCP","54","88  >  49171 [ACK] Seq=1546 Ack=318 Win=65536 Len=0"
"174","01:06:10.730768","172.16.1.4","172.16.1.201","TCP","54","88  >  49171 [RST, ACK] Seq=1546 Ack=318 Win=0 Len=0"
"175","01:06:10.731546","172.16.1.201","172.16.1.4","TCP","66","49172  >  88 [SYN] Seq=0 Win=8192 Len=0 MSS=1460 WS=256 SACK_PERM=1"
"176","01:06:10.731577","172.16.1.4","172.16.1.201","TCP","66","88  >  49172 [SYN, ACK] Seq=0 Ack=1 Win=8192 Len=0 MSS=1460 WS=256 SACK_PERM=1"
"177","01:06:10.731913","172.16.1.201","172.16.1.4","TCP","60","49172  >  88 [ACK] Seq=1 Ack=1 Win=65536 Len=0"
"178","01:06:10.732260","172.16.1.201","172.16.1.4","TCP","1514","49172  >  88 [ACK] Seq=1 Ack=1 Win=65536 Len=1460 [TCP segment of a reassembled PDU]"
"179","01:06:10.732261","172.16.1.201","172.16.1.4","KRB5","110","TGS-REQ"
"180","01:06:10.732278","172.16.1.4","172.16.1.201","TCP","54","88  >  49172 [ACK] Seq=1 Ack=1517 Win=65536 Len=0"
"181","01:06:10.733391","172.16.1.4","172.16.1.201","KRB5","1530","TGS-REP"
"182","01:06:10.734165","172.16.1.201","172.16.1.4","TCP","60","49172  >  88 [ACK] Seq=1517 Ack=1477 Win=65536 Len=0"
"183","01:06:10.734166","172.16.1.201","172.16.1.4","TCP","60","49172  >  88 [FIN, ACK] Seq=1517 Ack=1477 Win=65536 Len=0"
"184","01:06:10.734188","172.16.1.4","172.16.1.201","TCP","54","88  >  49172 [ACK] Seq=1477 Ack=1518 Win=65536 Len=0"
"185","01:06:10.734227","172.16.1.4","172.16.1.201","TCP","54","88  >  49172 [RST, ACK] Seq=1477 Ack=1518 Win=0 Len=0"
"186","01:06:10.736560","172.16.1.201","172.16.1.4","LDAP","1073","SASL GSS-API Integrity: searchRequest(12) ""CN=Certificate Templates,CN=Public Key Services,CN=Services,CN=Configuration,DC=carlforce,DC=com"" wholeSubtree "
"187","01:06:10.736903","172.16.1.4","172.16.1.201","LDAP","108","SASL GSS-API Integrity: searchResDone(12) success  [1 result]"
"188","01:06:10.737238","172.16.1.201","172.16.1.4","LDAP","97","SASL GSS-API Integrity: unbindRequest(13) "
"189","01:06:10.737315","172.16.1.4","172.16.1.201","TCP","54","389  >  49168 [RST, ACK] Seq=475 Ack=2899 Win=0 Len=0"
"190","01:06:10.737619","172.16.1.201","172.16.1.4","TCP","60","49168  >  389 [FIN, ACK] Seq=2899 Ack=475 Win=65024 Len=0"
"191","01:06:10.737619","172.16.1.201","172.16.1.4","LDAP","97","SASL GSS-API Integrity: unbindRequest(14) "
"192","01:06:10.737620","172.16.1.201","172.16.1.4","TCP","60","49158  >  389 [FIN, ACK] Seq=2733 Ack=3200 Win=64768 Len=0"
"193","01:06:10.737663","172.16.1.4","172.16.1.201","TCP","54","389  >  49158 [ACK] Seq=3200 Ack=2734 Win=64768 Len=0"
"194","01:06:10.737736","172.16.1.4","172.16.1.201","TCP","54","389  >  49158 [RST, ACK] Seq=3200 Ack=2734 Win=0 Len=0"
"195","01:06:10.749583","172.16.1.201","172.16.1.4","TCP","66","49173  >  88 [SYN] Seq=0 Win=8192 Len=0 MSS=1460 WS=256 SACK_PERM=1"
"196","01:06:10.749631","172.16.1.4","172.16.1.201","TCP","66","88  >  49173 [SYN, ACK] Seq=0 Ack=1 Win=8192 Len=0 MSS=1460 WS=256 SACK_PERM=1"
"197","01:06:10.749970","172.16.1.201","172.16.1.4","TCP","60","49173  >  88 [ACK] Seq=1 Ack=1 Win=65536 Len=0"
"198","01:06:10.750325","172.16.1.201","172.16.1.4","KRB5","1461","TGS-REQ"
"199","01:06:10.751515","172.16.1.4","172.16.1.201","KRB5","1480","TGS-REP"
"200","01:06:10.752291","172.16.1.201","172.16.1.4","TCP","60","49173  >  88 [FIN, ACK] Seq=1408 Ack=1427 Win=64256 Len=0"
"201","01:06:10.752292","172.16.1.201","172.16.1.4","TCP","66","49174  >  88 [SYN] Seq=0 Win=8192 Len=0 MSS=1460 WS=256 SACK_PERM=1"
"202","01:06:10.752314","172.16.1.4","172.16.1.201","TCP","54","88  >  49173 [ACK] Seq=1427 Ack=1409 Win=65536 Len=0"
"203","01:06:10.752348","172.16.1.4","172.16.1.201","TCP","66","88  >  49174 [SYN, ACK] Seq=0 Ack=1 Win=8192 Len=0 MSS=1460 WS=256 SACK_PERM=1"
"204","01:06:10.752389","172.16.1.4","172.16.1.201","TCP","54","88  >  49173 [RST, ACK] Seq=1427 Ack=1409 Win=0 Len=0"
"205","01:06:10.752668","172.16.1.201","172.16.1.4","TCP","60","49174  >  88 [ACK] Seq=1 Ack=1 Win=65536 Len=0"
"206","01:06:10.753001","172.16.1.201","172.16.1.4","TCP","1514","49174  >  88 [ACK] Seq=1 Ack=1 Win=65536 Len=1460 [TCP segment of a reassembled PDU]"
"207","01:06:10.753003","172.16.1.201","172.16.1.4","KRB5","1072","TGS-REQ"
"208","01:06:10.753022","172.16.1.4","172.16.1.201","TCP","54","88  >  49174 [ACK] Seq=1 Ack=2479 Win=65536 Len=0"
"209","01:06:10.753933","172.16.1.4","172.16.1.201","KRB5","186","KRB Error: KRB5KDC_ERR_BADOPTION NT Status: STATUS_NOT_SUPPORTED"
"210","01:06:10.754272","172.16.1.201","172.16.1.4","TCP","60","49174  >  88 [FIN, ACK] Seq=2479 Ack=133 Win=65536 Len=0"
"211","01:06:10.754292","172.16.1.4","172.16.1.201","TCP","54","88  >  49174 [ACK] Seq=133 Ack=2480 Win=65536 Len=0"
"212","01:06:10.754331","172.16.1.4","172.16.1.201","TCP","54","88  >  49174 [RST, ACK] Seq=133 Ack=2480 Win=0 Len=0"
"213","01:06:10.796177","172.16.1.201","172.16.1.4","TCP","60","49160  >  135 [ACK] Seq=329 Ack=281 Win=65280 Len=0"
"214","01:06:10.889744","172.16.1.201","172.16.1.4","TCP","60","49166  >  135 [ACK] Seq=329 Ack=281 Win=65280 Len=0"
"215","01:06:10.889745","172.16.1.201","172.16.1.4","TCP","60","49162  >  49155 [ACK] Seq=2961 Ack=1446 Win=64000 Len=0"
"216","01:06:10.905348","172.16.1.201","172.16.1.4","TCP","60","49167  >  49155 [ACK] Seq=3186 Ack=982 Win=64512 Len=0"
"217","01:06:11.139452","172.16.1.201","224.0.0.252","LLMNR","66","Standard query 0x229b A isatap"
"218","01:06:11.201831","172.16.1.201","172.16.1.4","DNS","76","Standard query 0x6ef6 A www.msftncsi.com"
"219","01:06:11.202087","172.16.1.201","172.16.1.4","DNS","76","Standard query 0x6ef6 A www.msftncsi.com"
"220","01:06:11.240741","172.16.1.201","172.16.1.255","NBNS","92","Name query NB CARLFORCE<1c>"
"221","01:06:11.241592","172.16.1.201","172.16.1.255","SMB_NETLOGON","281","SAM LOGON request from client"
"222","01:06:11.242257","172.16.1.4","172.16.1.255","NBNS","92","Name query NB NEWARK-1A<00>"
"223","01:06:11.248147","172.16.1.201","224.0.0.252","LLMNR","66","Standard query 0x229b A isatap"
"224","01:06:11.248191","172.16.1.201","172.16.1.255","NBNS","92","Name query NB CARLFORCE<1c>"
"225","01:06:11.248986","172.16.1.201","172.16.1.255","SMB_NETLOGON","281","SAM LOGON request from client"
"226","01:06:11.312280","172.16.1.201","173.223.52.18","TCP","66","49157  >  80 [SYN] Seq=0 Win=8192 Len=0 MSS=1460 WS=256 SACK_PERM=1"
"227","01:06:11.368211","173.223.52.18","172.16.1.201","TCP","66","80  >  49157 [SYN, ACK] Seq=0 Ack=1 Win=29200 Len=0 MSS=1288 SACK_PERM=1 WS=32"
"228","01:06:11.368552","172.16.1.201","173.223.52.18","TCP","60","49157  >  80 [ACK] Seq=1 Ack=1 Win=65536 Len=0"
"229","01:06:11.368731","172.16.1.201","173.223.52.18","HTTP","151","GET /ncsi.txt HTTP/1.1 "
"230","01:06:11.404654","172.16.1.201","172.16.1.255","NBNS","92","Name query NB ISATAP<00>"
"231","01:06:11.420135","173.223.52.18","172.16.1.201","TCP","54","80  >  49157 [ACK] Seq=1 Ack=98 Win=29216 Len=0"
"232","01:06:11.420563","173.223.52.18","172.16.1.201","HTTP","233","HTTP/1.1 200 OK  (text/plain)"
"233","01:06:11.420606","173.223.52.18","172.16.1.201","TCP","54","80  >  49157 [FIN, ACK] Seq=180 Ack=98 Win=29216 Len=0"
"234","01:06:11.420821","172.16.1.201","173.223.52.18","TCP","60","49157  >  80 [ACK] Seq=98 Ack=181 Win=65280 Len=0"
"235","01:06:11.420954","172.16.1.201","173.223.52.18","TCP","60","49157  >  80 [FIN, ACK] Seq=98 Ack=181 Win=65280 Len=0"
"236","01:06:11.451243","172.16.1.201","172.16.1.255","NBNS","92","Name query NB ISATAP<00>"
"237","01:06:11.475042","173.223.52.18","172.16.1.201","TCP","54","80  >  49157 [ACK] Seq=181 Ack=99 Win=29216 Len=0"
"238","01:06:12.169011","172.16.1.201","172.16.1.255","NBNS","92","Name query NB ISATAP<00>"
"239","01:06:12.215380","172.16.1.201","172.16.1.255","NBNS","92","Name query NB ISATAP<00>"
"240","01:06:12.937031","172.16.1.201","172.16.1.4","DNS","80","Standard query 0x690d A isatap.carlforce.com"
"241","01:06:12.937176","172.16.1.4","172.16.1.201","DNS","154","Standard query response 0x690d No such name A isatap.carlforce.com SOA carlforce-dc1.carlforce.com"
"242","01:06:12.938229","172.16.1.201","224.0.0.252","LLMNR","66","Standard query 0x2c7e A isatap"
"243","01:06:12.938696","172.16.1.201","172.16.1.4","DNS","83","Standard query 0xc110 SOA Newark-1a.carlforce.com"
"244","01:06:12.938801","172.16.1.4","172.16.1.201","DNS","160","Standard query response 0xc110 SOA Newark-1a.carlforce.com SOA carlforce-dc1.carlforce.com A 172.16.1.4"
"245","01:06:12.940478","172.16.1.201","172.16.1.4","DNS","148","Dynamic update 0x2e52 SOA carlforce.com CNAME AAAA A A 172.16.1.201"
"246","01:06:12.941422","172.16.1.4","172.16.1.201","DNS","148","Dynamic update response 0x2e52 SOA carlforce.com CNAME AAAA A A 172.16.1.201"
"247","01:06:12.979774","172.16.1.201","172.16.1.255","NBNS","92","Name query NB ISATAP<00>"
"248","01:06:13.042611","172.16.1.201","224.0.0.252","LLMNR","66","Standard query 0x2c7e A isatap"
"249","01:06:13.242803","172.16.1.201","172.16.1.4","TCP","66","49175  >  88 [SYN] Seq=0 Win=8192 Len=0 MSS=1460 WS=256 SACK_PERM=1"
"250","01:06:13.242856","172.16.1.4","172.16.1.201","TCP","66","88  >  49175 [SYN, ACK] Seq=0 Ack=1 Win=8192 Len=0 MSS=1460 WS=256 SACK_PERM=1"
"251","01:06:13.243193","172.16.1.201","172.16.1.4","TCP","60","49175  >  88 [ACK] Seq=1 Ack=1 Win=65536 Len=0"
"252","01:06:13.243534","172.16.1.201","172.16.1.4","KRB5","290","AS-REQ"
"253","01:06:13.244075","172.16.1.4","172.16.1.201","KRB5","324","KRB Error: KRB5KDC_ERR_PREAUTH_REQUIRED"
"254","01:06:13.244762","172.16.1.201","172.16.1.4","TCP","60","49175  >  88 [FIN, ACK] Seq=237 Ack=271 Win=65280 Len=0"
"255","01:06:13.244783","172.16.1.4","172.16.1.201","TCP","54","88  >  49175 [ACK] Seq=271 Ack=238 Win=65536 Len=0"
"256","01:06:13.244825","172.16.1.4","172.16.1.201","TCP","54","88  >  49175 [RST, ACK] Seq=271 Ack=238 Win=0 Len=0"
"257","01:06:13.245630","172.16.1.201","172.16.1.255","NBNS","92","Name query NB ISATAP<00>"
"258","01:06:13.277179","172.16.1.201","172.16.1.4","TCP","66","49176  >  88 [SYN] Seq=0 Win=8192 Len=0 MSS=1460 WS=256 SACK_PERM=1"
"259","01:06:13.277228","172.16.1.4","172.16.1.201","TCP","66","88  >  49176 [SYN, ACK] Seq=0 Ack=1 Win=8192 Len=0 MSS=1460 WS=256 SACK_PERM=1"
"260","01:06:13.277566","172.16.1.201","172.16.1.4","TCP","60","49176  >  88 [ACK] Seq=1 Ack=1 Win=65536 Len=0"
"261","01:06:13.277900","172.16.1.201","172.16.1.4","KRB5","370","AS-REQ"
"262","01:06:13.278917","172.16.1.4","172.16.1.201","KRB5","1599","AS-REP"
"263","01:06:13.279788","172.16.1.201","172.16.1.4","TCP","60","49176  >  88 [ACK] Seq=317 Ack=1546 Win=65536 Len=0"
"264","01:06:13.279789","172.16.1.201","172.16.1.4","TCP","60","49176  >  88 [FIN, ACK] Seq=317 Ack=1546 Win=65536 Len=0"
"265","01:06:13.279813","172.16.1.4","172.16.1.201","TCP","54","88  >  49176 [ACK] Seq=1546 Ack=318 Win=65536 Len=0"
"266","01:06:13.279853","172.16.1.4","172.16.1.201","TCP","54","88  >  49176 [RST, ACK] Seq=1546 Ack=318 Win=0 Len=0"
"267","01:06:13.281003","172.16.1.201","172.16.1.4","TCP","66","49177  >  88 [SYN] Seq=0 Win=8192 Len=0 MSS=1460 WS=256 SACK_PERM=1"
"268","01:06:13.281054","172.16.1.4","172.16.1.201","TCP","66","88  >  49177 [SYN, ACK] Seq=0 Ack=1 Win=8192 Len=0 MSS=1460 WS=256 SACK_PERM=1"
"269","01:06:13.281393","172.16.1.201","172.16.1.4","TCP","60","49177  >  88 [ACK] Seq=1 Ack=1 Win=65536 Len=0"
"270","01:06:13.281816","172.16.1.201","172.16.1.4","TCP","1514","49177  >  88 [ACK] Seq=1 Ack=1 Win=65536 Len=1460 [TCP segment of a reassembled PDU]"
"271","01:06:13.281818","172.16.1.201","172.16.1.4","KRB5","149","TGS-REQ"
"272","01:06:13.281837","172.16.1.4","172.16.1.201","TCP","54","88  >  49177 [ACK] Seq=1 Ack=1556 Win=65536 Len=0"
"273","01:06:13.282267","172.16.1.4","172.16.1.201","KRB5","150","KRB Error: KRB5KDC_ERR_S_PRINCIPAL_UNKNOWN"
"274","01:06:13.282933","172.16.1.201","172.16.1.4","TCP","60","49177  >  88 [FIN, ACK] Seq=1556 Ack=97 Win=65536 Len=0"
"275","01:06:13.282952","172.16.1.4","172.16.1.201","TCP","54","88  >  49177 [ACK] Seq=97 Ack=1557 Win=65536 Len=0"
"276","01:06:13.282992","172.16.1.4","172.16.1.201","TCP","54","88  >  49177 [RST, ACK] Seq=97 Ack=1557 Win=0 Len=0"
"277","01:06:13.749173","172.16.1.201","224.0.0.252","LLMNR","66","Standard query 0x2c7e A isatap"
"278","01:06:13.853407","172.16.1.201","224.0.0.252","LLMNR","66","Standard query 0x2c7e A isatap"
"279","01:06:14.009786","172.16.1.201","172.16.1.255","NBNS","92","Name query NB ISATAP<00>"
"280","01:06:14.056427","172.16.1.201","172.16.1.255","NBNS","92","Name query NB ISATAP<00>"
"281","01:06:14.774204","172.16.1.201","172.16.1.255","NBNS","92","Name query NB ISATAP<00>"
"282","01:06:14.820621","172.16.1.201","172.16.1.255","NBNS","92","Name query NB ISATAP<00>"
"283","01:06:15.585038","172.16.1.201","172.16.1.255","NBNS","92","Name query NB ISATAP<00>"
"284","01:06:15.657076","172.16.1.201","172.16.1.255","NBNS","92","Name query NB ISATAP<00>"
"285","01:06:16.412202","172.16.1.201","172.16.1.255","NBNS","92","Name query NB ISATAP<00>"
"286","01:06:16.467952","172.16.1.201","172.16.1.255","NBNS","92","Name query NB ISATAP<00>"
"287","01:06:17.176583","172.16.1.201","172.16.1.255","NBNS","92","Name query NB ISATAP<00>"
"288","01:06:17.223108","172.16.1.201","172.16.1.255","NBNS","92","Name query NB ISATAP<00>"
"289","01:06:17.941875","172.16.1.201","172.16.1.255","NBNS","92","Name query NB ISATAP<00>"
"290","01:06:17.987509","172.16.1.201","172.16.1.255","NBNS","92","Name query NB ISATAP<00>"
"291","01:06:18.705363","172.16.1.201","172.16.1.255","NBNS","92","Name query NB ISATAP<00>"
"292","01:06:18.752820","172.16.1.201","172.16.1.255","NBNS","92","Name query NB ISATAP<00>"
"293","01:06:19.469760","172.16.1.201","172.16.1.255","NBNS","92","Name query NB ISATAP<00>"
"294","01:06:19.516353","172.16.1.201","172.16.1.255","NBNS","92","Name query NB ISATAP<00>"
"295","01:06:20.234809","172.16.1.201","172.16.1.255","NBNS","92","Name query NB ISATAP<00>"
"296","01:06:20.280756","172.16.1.201","172.16.1.255","NBNS","92","Name query NB ISATAP<00>"
"297","01:06:20.998543","172.16.1.201","172.16.1.255","NBNS","92","Name query NB ISATAP<00>"
"298","01:06:21.045852","172.16.1.201","172.16.1.255","NBNS","92","Name query NB ISATAP<00>"
"299","01:06:21.763028","172.16.1.201","172.16.1.255","NBNS","92","Name query NB ISATAP<00>"
"300","01:06:21.809605","172.16.1.201","172.16.1.255","NBNS","92","Name query NB ISATAP<00>"
"301","01:06:21.968528","172.16.1.201","172.16.1.4","TCP","66","49178  >  88 [SYN] Seq=0 Win=8192 Len=0 MSS=1460 WS=256 SACK_PERM=1"
"302","01:06:21.968591","172.16.1.4","172.16.1.201","TCP","66","88  >  49178 [SYN, ACK] Seq=0 Ack=1 Win=8192 Len=0 MSS=1460 WS=256 SACK_PERM=1"
"303","01:06:21.968933","172.16.1.201","172.16.1.4","TCP","60","49178  >  88 [ACK] Seq=1 Ack=1 Win=65536 Len=0"
"304","01:06:21.968933","172.16.1.201","172.16.1.4","KRB5","279","AS-REQ"
"305","01:06:21.969604","172.16.1.4","172.16.1.201","KRB5","270","KRB Error: KRB5KDC_ERR_PREAUTH_REQUIRED"
"306","01:06:21.969937","172.16.1.201","172.16.1.4","TCP","60","49178  >  88 [FIN, ACK] Seq=226 Ack=217 Win=65280 Len=0"
"307","01:06:21.969957","172.16.1.4","172.16.1.201","TCP","54","88  >  49178 [ACK] Seq=217 Ack=227 Win=65536 Len=0"
"308","01:06:21.970002","172.16.1.4","172.16.1.201","TCP","54","88  >  49178 [RST, ACK] Seq=217 Ack=227 Win=0 Len=0"
"309","01:06:21.991255","172.16.1.201","172.16.1.4","TCP","66","49179  >  88 [SYN] Seq=0 Win=8192 Len=0 MSS=1460 WS=256 SACK_PERM=1"
"310","01:06:21.991304","172.16.1.4","172.16.1.201","TCP","66","88  >  49179 [SYN, ACK] Seq=0 Ack=1 Win=8192 Len=0 MSS=1460 WS=256 SACK_PERM=1"
"311","01:06:21.991643","172.16.1.201","172.16.1.4","TCP","60","49179  >  88 [ACK] Seq=1 Ack=1 Win=65536 Len=0"
"312","01:06:21.991644","172.16.1.201","172.16.1.4","KRB5","358","AS-REQ"
"313","01:06:21.992672","172.16.1.4","172.16.1.201","KRB5","1581","AS-REP"
"314","01:06:21.993453","172.16.1.201","172.16.1.4","TCP","60","49179  >  88 [ACK] Seq=305 Ack=1528 Win=65536 Len=0"
"315","01:06:21.993454","172.16.1.201","172.16.1.4","TCP","60","49179  >  88 [FIN, ACK] Seq=305 Ack=1528 Win=65536 Len=0"
"316","01:06:21.993477","172.16.1.4","172.16.1.201","TCP","54","88  >  49179 [ACK] Seq=1528 Ack=306 Win=65536 Len=0"
"317","01:06:21.993515","172.16.1.4","172.16.1.201","TCP","54","88  >  49179 [RST, ACK] Seq=1528 Ack=306 Win=0 Len=0"
"318","01:06:21.993802","172.16.1.201","172.16.1.4","TCP","66","49180  >  88 [SYN] Seq=0 Win=8192 Len=0 MSS=1460 WS=256 SACK_PERM=1"
"319","01:06:21.993834","172.16.1.4","172.16.1.201","TCP","66","88  >  49180 [SYN, ACK] Seq=0 Ack=1 Win=8192 Len=0 MSS=1460 WS=256 SACK_PERM=1"
"320","01:06:21.994169","172.16.1.201","172.16.1.4","TCP","60","49180  >  88 [ACK] Seq=1 Ack=1 Win=65536 Len=0"
"321","01:06:21.994535","172.16.1.201","172.16.1.4","KRB5","1468","TGS-REQ"
"322","01:06:21.995608","172.16.1.4","172.16.1.201","KRB5","1492","TGS-REP"
"323","01:06:21.996437","172.16.1.201","172.16.1.4","TCP","60","49180  >  88 [FIN, ACK] Seq=1415 Ack=1439 Win=64256 Len=0"
"324","01:06:21.996459","172.16.1.4","172.16.1.201","TCP","54","88  >  49180 [ACK] Seq=1439 Ack=1416 Win=65536 Len=0"
"325","01:06:21.996496","172.16.1.4","172.16.1.201","TCP","54","88  >  49180 [RST, ACK] Seq=1439 Ack=1416 Win=0 Len=0"
"326","01:06:22.528340","172.16.1.201","172.16.1.255","NBNS","92","Name query NB ISATAP<00>"
"327","01:06:22.562146","172.16.1.201","172.16.1.4","DNS","73","Standard query 0x2eb6 A CARLFORCE.COM"
"328","01:06:22.562276","172.16.1.4","172.16.1.201","DNS","89","Standard query response 0x2eb6 A CARLFORCE.COM A 172.16.1.4"
"329","01:06:22.574103","172.16.1.201","172.16.1.255","NBNS","92","Name query NB ISATAP<00>"
"330","01:06:22.575166","172.16.1.201","172.16.1.4","TCP","66","49181  >  445 [SYN] Seq=0 Win=8192 Len=0 MSS=1460 WS=256 SACK_PERM=1"
"331","01:06:22.575253","172.16.1.4","172.16.1.201","TCP","66","445  >  49181 [SYN, ACK] Seq=0 Ack=1 Win=8192 Len=0 MSS=1460 WS=256 SACK_PERM=1"
"332","01:06:22.575590","172.16.1.201","172.16.1.4","TCP","60","49181  >  445 [ACK] Seq=1 Ack=1 Win=65536 Len=0"
"333","01:06:22.578707","172.16.1.201","172.16.1.4","SMB","213","Negotiate Protocol Request"
"334","01:06:22.578990","172.16.1.4","172.16.1.201","SMB2","306","Negotiate Protocol Response"
"335","01:06:22.583427","172.16.1.201","172.16.1.4","SMB2","162","Negotiate Protocol Request"
